{"case_id":"T5010","gap_exists":true,"gap_type":["entry point","API protocol"],"commit_induced":"NO","maintenance_needed":false,"confidence":97,"affected_functions":["PList::Integer::Integer(const PList::Integer&)"],"reason":"H0 only invokes the C parsing entry points plist_from_bin, plist_from_json, plist_from_openstep, and plist_from_xml, so it does not directly exercise the C++ Integer copy constructor. That coverage gap already existed in S0: the same constructor and API boundary were present but unreachable from H0. The commit only changes its internal copy implementation from plist_set_uint_val(_node, i.GetValue()) to plist_copy(i.GetPlist()); it introduces no new entry point, protocol, state requirement, configuration, input semantics, or attack surface and does not materially aggravate the historical gap.","evidence":["S0 and S1 both contain PList::Integer::Integer(const PList::Integer& i).","H0 calls only plist_from_bin, plist_from_json, plist_from_openstep, and plist_from_xml, followed by plist_free.","The sole production change is inside the existing copy constructor: plist_set_uint_val(_node, i.GetValue()) is replaced by plist_free(_node) and _node = plist_copy(i.GetPlist()).","No changed declaration or newly introduced callable interface is shown."],"recommended_action":"No commit-specific harness maintenance is needed. A separate C++ API harness covering Integer copy construction could address the pre-existing coverage gap if desired."}