{"case_id":"C049","gap_exists":false,"gap_type":[],"commit_induced":"NO","maintenance_needed":false,"confidence":99,"affected_functions":["spng_set_chunk_limits","spng_get_chunk_limits","LLVMFuzzerTestOneInput"],"reason":"S1 only conditionally exposes existing chunk-limit declarations in src/spng.h under SPNG_UNTESTED. H0 already declares both functions with matching signatures and calls spng_set_chunk_limits(ctx, 4 * 1000 * 1000, 8 * 1000 * 1000), so it retains direct configuration control and continues exercising decoding through spng_decoded_image_size and spng_decode_image. No entry point, protocol, state, input-semantics, configuration, or attack-surface gap is created or aggravated.","evidence":["S1 adds declarations for spng_set_chunk_limits and spng_get_chunk_limits only inside #if defined(SPNG_UNTESTED).","H0 already contains matching forward declarations for spng_set_chunk_limits and spng_get_chunk_limits.","LLVMFuzzerTestOneInput invokes spng_set_chunk_limits on the spng_ctx before spng_decoded_image_size and spng_decode_image.","The complete production diff contains no implementation or behavioral change."],"recommended_action":"No fuzz-harness maintenance is needed for this commit."}