{"case_id":"C011","gap_exists":true,"gap_type":["entry point","API protocol","state","input semantics","attack surface"],"commit_induced":"YES","maintenance_needed":true,"confidence":99,"affected_functions":["decoder.decode_image_config?","decoder.decode_frame_config?","decoder.decode_frame?","decoder.restart_frame!"],"reason":"S1 adds a new JPEG image-decoder implementation and stateful decoding protocol, but H0 exclusively builds and invokes the JSON decoder. Consequently, H0 cannot reach the new JPEG input parsing, frame decoding, restart behavior, or call-sequence transitions. Because no matching JPEG implementation existed in S0, the commit introduced this material coverage gap.","evidence":["H0 defines WUFFS_CONFIG__MODULE__JSON and calls wuffs_json__decoder__decode_tokens; it does not define a JPEG module or instantiate decoder from std/jpeg/decode_jpeg.wuffs.","S1 creates std/jpeg/decode_jpeg.wuffs with externally supplied bytes consumed by decoder.decode_image_config? through args.src.read_u8?().","S1 introduces stateful entry points decoder.decode_image_config?, decoder.decode_frame_config?, decoder.decode_frame?, and decoder.restart_frame!, coordinated by this.call_sequence and frame_config_io_position.","The selected S0 context states that there was no matching declaration, while S1 contains the newly added decoder declarations."],"recommended_action":"Add a project-owned JPEG fuzz harness that instantiates this decoder, feeds fuzz-controlled JPEG bytes through the image/frame decode sequence, exercises suspensions and restarts, and varies destination pixel-buffer configuration and blend inputs."}