{"case_id":"T8059","gap_exists":true,"gap_type":["entry_point","attack_surface"],"commit_induced":"NO","maintenance_needed":false,"confidence":96,"affected_functions":["emitVertex","polygonize"],"reason":"H0 only invokes meshopt_simplify, meshopt_simplifyWithAttributes, and meshopt_simplifyWithUpdate, so it does not reach the changed remesher functions emitVertex and polygonize. This is a material coverage gap in S1, but the same remesher entry-point gap already existed with S0 + H0. The commit changes internal triangle-degeneracy and capacity-estimation behavior without introducing a new entry point, protocol, state, configuration, or input dimension, so it does not introduce or materially aggravate the harness gap.","evidence":["H0 contains calls only to meshopt_simplify, meshopt_simplifyWithAttributes, and meshopt_simplifyWithUpdate.","The production diff changes only static functions emitVertex and polygonize in src/remesher.cpp.","Neither emitVertex nor polygonize is referenced by H0 in either S0 + H0 or S1 + H0.","polygonize now calls emitVertex even when destination is NULL or result is at max_triangle_count, changing internal degeneracy-based result accounting but not the harness-accessible API surface."],"recommended_action":"No commit-specific harness maintenance is required. A separate remesher-focused harness could address the pre-existing coverage gap independently of this commit."}