{"case_id":"T5006","gap_exists":true,"gap_type":["entry point","input semantics","attack surface"],"commit_induced":"YES","maintenance_needed":true,"confidence":99,"affected_functions":["plist_from_openstep","node_from_openstep","parse_dict_data","parse_skip_ws","plist_to_openstep","node_to_openstep","node_estimate_size"],"reason":"S1 adds a distinct OpenStep plist parser and public import entry point, but H0 invokes only plist_from_bin, plist_from_json, and plist_from_xml. Therefore fuzz bytes cannot reach the new OpenStep grammar and parsing implementation. This is a new commit-induced attack surface, not a historical gap.","evidence":["include/plist/plist.h adds the public declaration plist_from_openstep(const char *openstep, uint32_t length, plist_t *plist).","src/oplist.c is entirely new and implements OpenStep-specific parsing through plist_from_openstep, node_from_openstep, parse_dict_data, and parse_skip_ws.","H0's three LLVMFuzzerTestOneInput functions call only plist_from_bin, plist_from_json, and plist_from_xml; none calls plist_from_openstep or plist_from_memory.","src/plist.c changes plist_from_memory so inputs not classified as binary, XML, or JSON are dispatched to plist_from_openstep, but no H0 harness invokes plist_from_memory.","S0 has no matching plist_from_openstep declaration, while S1 exposes it, so the uncovered parser surface was introduced by this commit."],"recommended_action":"Add an OpenStep fuzz target that passes the full fuzzer-controlled buffer and length directly to plist_from_openstep and frees the resulting plist. Optionally serialize successful parses with plist_to_openstep using a fuzz-controlled prettify value to cover the newly added writer."}