{"case_id":"C002","gap_exists":true,"gap_type":["configuration","API protocol","state"],"commit_induced":"YES","maintenance_needed":true,"confidence":99,"affected_functions":["LLVMFuzzerTestOneInput","fuzzRoundtrip","meshopt_encodeVertexVersion","meshopt_encodeVertexBufferLevel"],"reason":"S1 changes the supported vertex encoder version from experimental value 0xe to public value 1, but H0 still calls meshopt_encodeVertexVersion(0xe) whenever level < 4. Under S1, assert(unsigned(version) <= 1) rejects that configuration, so most inputs terminate before fuzzRoundtrip exercises meshopt_encodeVertexBufferLevel and the encode/decode roundtrip. The same H0 call was valid under S0, whose assertion explicitly allowed version == 0xe, so the gap is commit-induced.","evidence":["H0 computes level = data0 % 5 and calls meshopt_encodeVertexVersion(level < 4 ? 0xe : 0), selecting 0xe for levels 0 through 3.","S0 meshopt_encodeVertexVersion accepted version == 0xe via assert(unsigned(version) <= 0 || version == 0xe).","S1 replaces that contract with assert(unsigned(version) <= 1), making H0's 0xe configuration invalid.","The public declaration now identifies valid values as 0 and 1, and S1 callers replace meshopt_encodeVertexVersion(0xe) with meshopt_encodeVertexVersion(1).","fuzzRoundtrip calls meshopt_encodeVertexBufferLevel only after the invalid version-setting call, reducing encoder roundtrip reachability for four of five level selections."],"recommended_action":"Update H0 to select version 1 instead of 0xe while retaining version 0 coverage, for example meshopt_encodeVertexVersion(level < 4 ? 1 : 0)."}