{"case_id":"C012","gap_exists":false,"gap_type":[],"commit_induced":"NO","maintenance_needed":false,"confidence":99,"affected_functions":["wuffs_vp8__decoder__calculate_dequants","decoder.calculate_dequants","fuzz","fuzz_image_decoder"],"reason":"S1 only rewrites the internal modular addition in calculate_dequants into an explicitly cast but equivalent form. H0 still initializes wuffs_webp__decoder and passes its image-decoder upcast plus the fuzzed src to fuzz_image_decoder, so WebP/VP8 input continues to exercise the calculation with adequate input-driven state. No entry point, API protocol, configuration, state setup, input semantics, or attack surface changed.","evidence":["In decoder.calculate_dequants, `q ~mod+= sign_extend_convert_u8_u32(...)` becomes `q = (q as base.u32) ~mod+ sign_extend_convert_u8_u32(...)`; the supplied comment identifies the cast as redundant.","The generated wuffs_vp8__decoder__calculate_dequants change likewise replaces `v_q += ...` with an explicit uint32_t addition and assignment while preserving the same operands and downstream dequant calculations.","H0 enables WUFFS_CONFIG__MODULE__VP8 and WUFFS_CONFIG__MODULE__WEBP, initializes wuffs_webp__decoder, and invokes fuzz_image_decoder with its wuffs_base__image_decoder upcast.","The changed function remains internal to VP8 decoding and introduces no new callable entry point, mode, option, required state, or distinct input channel."],"recommended_action":"Keep H0 unchanged; no commit-specific harness maintenance is needed."}