{"case_id":"T5013","gap_exists":true,"gap_type":["entry point","state","configuration","API protocol"],"commit_induced":"YES","maintenance_needed":true,"confidence":89,"affected_functions":["ares_reinit","ares__init_by_sysconfig","ares_sysconfig_apply"],"reason":"H0 only invokes `ares_create_query` and the `ares_parse_*_reply` functions; it never creates channel state or calls `ares_reinit`. S1 materially changes the synchronization protocol by moving `ares__channel_lock(channel)` past `ares__init_by_sysconfig(channel)` and adding locking specifically around `ares_sysconfig_apply(channel, &sysconfig)`. Thus H0 cannot exercise the newly exposed unlocked configuration-retrieval phase, the locked apply phase, or their interaction with the later `channel->qcache` flush. Although absence of `ares_reinit` coverage existed in S0, these new lock boundaries and possible state interleavings are introduced by S1, materially aggravating the gap.","evidence":["`test/ares-test-fuzz-name.c` calls only `ares_create_query`.","`test/ares-test-fuzz.c` calls only `ares_parse_a_reply`, `ares_parse_aaaa_reply`, `ares_parse_ptr_reply`, `ares_parse_ns_reply`, `ares_parse_srv_reply`, `ares_parse_mx_reply`, `ares_parse_txt_reply`, `ares_parse_soa_reply`, `ares_parse_naptr_reply`, `ares_parse_caa_reply`, and `ares_parse_uri_reply`.","In S0, `ares_reinit` acquires `ares__channel_lock(channel)` before calling `ares__init_by_sysconfig(channel)` and retains it through the `channel->qcache` flush.","In S1, `ares_reinit` calls `ares__init_by_sysconfig(channel)` before acquiring the lock used for the `channel->qcache` flush.","In S1, `ares__init_by_sysconfig` newly locks and unlocks only around `ares_sysconfig_apply(channel, &sysconfig)`, while configuration retrieval and `ares__init_by_environment(&sysconfig)` occur outside that lock."],"recommended_action":"Add a stateful harness that supplies a valid `ares_channel_t` to `ares_reinit`, controls configuration and environment-derived inputs reaching `ares__init_by_sysconfig`, and exercises concurrent or deliberately interleaved channel activity so both the unlocked retrieval phase, locked `ares_sysconfig_apply` phase, and subsequent `channel->qcache` flush are covered."}