{"case_id":"C032","gap_exists":true,"gap_type":["entry point","API protocol","state","configuration"],"commit_induced":"YES","maintenance_needed":true,"confidence":98,"affected_functions":["decoder.get_quirk","decoder.set_quirk!","fuzz"],"reason":"S1 makes decoder.get_quirk state-dependent for base.QUIRK_IGNORE_CHECKSUM, but H0 only calls wuffs_bzip2__decoder__set_quirk and transform_io; it never invokes the changed get_quirk entry point. In S0, get_quirk always returned 0, so this material state-reporting behavior did not exist. The commit therefore creates an uncovered getter/setter protocol despite H0 already controlling ignore_checksum through hash.","evidence":["S1 decoder.get_quirk returns 1 when args.key == base.QUIRK_IGNORE_CHECKSUM and this.ignore_checksum is true.","S0 decoder.get_quirk unconditionally returns 0.","H0 fuzz calls wuffs_bzip2__decoder__set_quirk(&dec, WUFFS_BASE__QUIRK_IGNORE_CHECKSUM, hash & 0xFFFE), providing input-dependent configuration state.","H0 contains no call to wuffs_bzip2__decoder__get_quirk, so the newly changed function is unreachable from the harness."],"recommended_action":"After set_quirk succeeds, call wuffs_bzip2__decoder__get_quirk for WUFFS_BASE__QUIRK_IGNORE_CHECKSUM and verify that it returns 1 exactly when hash & 0xFFFE is nonzero; retain transform_io coverage."}