{"case_id":"T5008","gap_exists":true,"gap_type":["entry_point","configuration","input_semantics","attack_surface"],"commit_induced":"YES","maintenance_needed":true,"confidence":99,"affected_functions":["meshopt_remesh"],"reason":"S1 adds the public production entry point meshopt_remesh, but H0 never calls it. Consequently H0 cannot exercise its distinct pointer/count inputs or control the validity boundaries enforced for index_count, vertex_positions_stride, and resolution. S0 had no matching declaration, so this uncovered API surface and its gap were introduced by the commit.","evidence":["src/meshoptimizer.h adds MESHOPTIMIZER_API size_t meshopt_remesh(...) with destination, max_triangle_count, indices, index_count, vertex_positions, vertex_count, vertex_positions_stride, resolution, and options inputs.","src/remesher.cpp newly defines meshopt_remesh and checks index_count % 3 == 0, vertex_positions_stride between 12 and 256 and float-aligned, and resolution between 1 and 250.","H0 tools/clusterfuzz.cpp calls meshlet-building and meshopt_partitionClusters APIs, tools/codecfuzz.cpp calls codec APIs, and tools/simplifyfuzz.cpp calls simplification APIs; none calls meshopt_remesh.","The S0 declaration context states that no matching declaration existed, while S1 contains meshopt_remesh at src/meshoptimizer.h line 518."],"recommended_action":"Extend a mesh-oriented harness, most naturally tools/simplifyfuzz.cpp, to invoke meshopt_remesh with fuzz-controlled valid index data, vertex positions, counts, stride, resolution, options, and appropriately sized destination storage."}