{"case_id":"T8052","gap_exists":true,"gap_type":["entry point","API protocol","input semantics"],"commit_induced":"YES","maintenance_needed":true,"confidence":96,"affected_functions":["plist_array_set_item","plist_array_append_item","plist_array_insert_item","plist_dict_set_item"],"reason":"S1 adds new public-API behavior for a NULL `item` in four mutation functions, but H0 only passes fuzz bytes to `plist_from_bin` and then calls `plist_free`. It provides no direct calls or argument control for supplying NULL as `item`, so the newly added early-return behavior is not adequately exercised. Because these NULL checks are introduced by S1, the coverage gap is commit-induced rather than merely historical.","evidence":["H0's only production entry call is `plist_from_bin(reinterpret_cast<const char*>(data), size, &root_node)`.","H0 does not call `plist_array_set_item`, `plist_array_append_item`, `plist_array_insert_item`, or `plist_dict_set_item`.","S1 adds `if (!item) { return; }` to each affected function.","The fuzz-controlled values in H0 are only `data` and `size`; H0 has no fuzz-controlled `plist_t item` argument or mutation-operation selection."],"recommended_action":"Extend or add a harness that constructs array and dictionary nodes and directly invokes all four affected APIs with NULL and non-NULL `item` values, while controlling indices and dictionary keys."}