{"case_id":"T5022","gap_exists":false,"gap_type":[],"commit_induced":"NO","maintenance_needed":false,"confidence":96,"affected_functions":["plist_mem_free","plist_to_bin_free","plist_to_xml_free"],"reason":"S1 adds `plist_mem_free` as a null-checked wrapper around `free` and removes the equivalent format-specific wrappers `plist_to_bin_free` and `plist_to_xml_free`. H0 does not call these output-buffer deallocation APIs, but the commit does not add materially fuzzable input semantics, state, configuration, or attack surface: both harnesses still exercise their parser entry points and correctly release parsed nodes with `plist_free`. The unexercised export/getter ownership protocol predates this commit, so consolidating its deallocator does not introduce or materially aggravate a harness gap.","evidence":["`fuzz/bplist_fuzzer.cc` calls `plist_from_bin` and then `plist_free(root_node)`.","`fuzz/xplist_fuzzer.cc` calls `plist_from_xml` and then `plist_free(root_node)`.","`plist_mem_free(void* ptr)` only checks `ptr` and calls `free(ptr)`.","The header identifies `plist_mem_free` as the replacement deallocator for buffers returned by existing APIs including `plist_to_xml`, `plist_to_bin`, `plist_get_key_val`, `plist_get_string_val`, and `plist_get_data_val`.","The removed `plist_to_bin_free` and `plist_to_xml_free` implementations each only called `free` and were not exercised by H0 before the commit."],"recommended_action":"No harness maintenance is required for this commit."}