{"case_id":"C020","gap_exists":false,"gap_type":[],"commit_induced":"NO","maintenance_needed":false,"confidence":96,"affected_functions":["BrotliDecoderCreateInstance","BrotliDecoderDecompressStream","DecodeWindowBits","DecodeMetaBlockLength","ReadHuffmanCode","DecodeContextMap","BrotliGetDictionary"],"reason":"H0 still exercises the decoder through BrotliDecoderCreateInstance and BrotliDecoderDecompressStream with arbitrary compressed bytes, persistent streaming state, input chunking selected by the fuzz data, and repeated output-buffer calls. The S1 additions are decoder internals, constants, tables, and the static dictionary; they do not establish a new decoding protocol or input dimension that H0 cannot reach. BrotliGetDictionary is a data accessor rather than a separate untrusted-input processing entry point. Default allocator use is unchanged in H0 and the diff does not show a commit-created requirement to control custom allocators.","evidence":["H0 passes the fuzz buffer through BrotliDecoderDecompressStream and preserves one BrotliDecoderState across calls.","H0 derives addend from data[size - 1] & 7, covering both whole-input and 1-to-7-byte streaming delivery paths.","H0 repeatedly supplies a 1024-byte output buffer while BROTLI_DECODER_RESULT_NEEDS_MORE_OUTPUT is returned.","S1 implements BrotliDecoderCreateInstance with the same alloc_func, free_func, and opaque parameters that H0 already invokes as 0, 0, 0.","S1 parsing routines such as DecodeWindowBits, DecodeMetaBlockLength, ReadHuffmanCode, and DecodeContextMap consume the same Brotli input stream reached by H0.","The new kBrotliDictionary and BrotliGetDictionary provide decoder data used according to compressed-stream semantics, which arbitrary H0 input can select through decoding."],"recommended_action":"No harness maintenance is needed for this commit; retain H0's existing streaming and output-buffer coverage."}