{"case_id":"T8022","gap_exists":true,"gap_type":["API protocol"],"commit_induced":"YES","maintenance_needed":true,"confidence":99,"affected_functions":["xmlFuzzResourceLoader","fuzzResourceRecorder","xmlNewInputFromMemory","xmlNewInputFromUrl"],"reason":"S1 removes the API names used by H0 and replaces them with new public names. Consequently, S1 + H0 cannot compile or link those harness call sites without maintenance, whereas S0 + H0 uses matching declarations and definitions.","evidence":["H0 function xmlFuzzResourceLoader calls xmlInputCreateMemory.","S1 removes the xmlInputCreateMemory declaration from include/libxml/parserInternals.h and renames its parserInternals.c definition to xmlNewInputFromMemory, declared in include/libxml/parser.h.","H0 function fuzzResourceRecorder calls xmlInputCreateUrl twice.","S1 removes the xmlInputCreateUrl declaration and renames its definition to xmlNewInputFromUrl.","The changes are direct renames rather than internal behavior changes reachable through the unchanged H0 API."],"recommended_action":"Update H0 call sites from xmlInputCreateMemory to xmlNewInputFromMemory and from xmlInputCreateUrl to xmlNewInputFromUrl, then rebuild the harness and seed generator."}