{"case_id":"C038","gap_exists":true,"gap_type":["entry_point","configuration","attack_surface"],"commit_induced":"YES","maintenance_needed":true,"confidence":99,"affected_functions":["decoder.decode_image_config?","decoder.decode_frame_config?","decoder.decode_frame?","decoder.from_src_to_buffer?","decoder.decode_half_block!","decoder.from_buffer_to_dst!"],"reason":"S1 adds a new ETC2/PKM image-decoder attack surface, but H0 exclusively compiles and instantiates the JPEG decoder. Therefore no H0-controlled input can reach the new decoder or its block-decoding logic. S0 had no matching decoder declaration, so the gap was introduced by this commit.","evidence":["H0 defines WUFFS_CONFIG__MODULE__JPEG and does not enable an ETC2 module.","H0's fuzz function constructs wuffs_jpeg__decoder and passes its image_decoder upcast to fuzz_image_decoder.","S1 introduces pub struct decoder? implements base.image_decoder in std/etc2/decode_etc2.wuffs.","The new decoder accepts PKM input through decoder.decode_image_config? and processes attacker-controlled 64-bit blocks through decoder.from_src_to_buffer? and decoder.decode_half_block!.","The selected S0 context states that there was no matching declaration."],"recommended_action":"Add a project-owned ETC2/PKM fuzz target that enables the ETC2 module, initializes the ETC2 decoder, and passes its base.image_decoder upcast plus fuzz-controlled input and hash to fuzz_image_decoder."}