{"case_id":"C044","gap_exists":true,"gap_type":["API protocol","entry point"],"commit_induced":"YES","maintenance_needed":true,"confidence":100,"affected_functions":["fuzz","wuffs_zlib__decoder__decode_io_writer"],"reason":"S1 adds the required `wuffs_base__slice_u8 a_workbuf` argument to `wuffs_zlib__decoder__decode_io_writer`, but H0 still calls that function with only `&dec`, `dst_writer`, and `src_reader`. H0 therefore no longer conforms to the decoder API and cannot reach the fuzzed behavior. S0 accepted H0's call, so this gap is directly introduced by the commit.","evidence":["H0 calls `wuffs_zlib__decoder__decode_io_writer(&dec, dst_writer, src_reader)`.","S0 declared `wuffs_zlib__decoder__decode_io_writer` with `self`, `a_dst`, and `a_src`.","S1 declares and defines it with an additional required `wuffs_base__slice_u8 a_workbuf` parameter.","S1 forwards `a_workbuf` from `wuffs_zlib__decoder__decode_io_writer` to `wuffs_deflate__decoder__decode_io_writer`."],"recommended_action":"Update H0's decode call to pass a `wuffs_base__slice_u8` work buffer, using an explicitly empty slice if no storage is required by the current implementation."}